[
  {
    "hypothesisId": "hyp-human-rhetorical-action",
    "caseId": "institutional-sacrificial-escalation",
    "title": "Human rhetorical agency",
    "proposedAgentIds": [
      "actor-lincoln"
    ],
    "agencyClaim": "The speaker intentionally uses commemorative rhetoric to connect prior deaths with continued commitment.",
    "agencyType": "intentional",
    "mechanismIds": [
      "mech-rhetorical-reframing"
    ],
    "mediumIds": [
      "med-public-address"
    ],
    "manifestations": [
      "the dead are linked to completion of an unfinished collective task"
    ],
    "evidenceSupport": [
      "obs-rhetorical-obligation",
      "event-address-delivered"
    ],
    "evidenceAgainst": [],
    "alternativeHypothesisIds": [
      "hyp-psychological-feedback",
      "hyp-institutional-agency",
      "hyp-symbolic-order",
      "hyp-layered-spiritual"
    ],
    "assumptions": [
      "the wording is purposeful rather than accidental"
    ],
    "falsifiers": [
      "evidence that the wording was not intended or was materially misattributed"
    ],
    "lowerLevelExplanationsAssessed": [],
    "independentEvidence": [
      "src-gettysburg-address"
    ],
    "status": "plausible",
    "explanatoryNecessity": "necessary",
    "empiricalStatus": "partially-discriminated",
    "theologicalStatus": "not-applicable",
    "humanReviewRequired": false,
    "createdBy": "human",
    "reviewStatus": "draft",
    "notes": ""
  },
  {
    "hypothesisId": "hyp-psychological-feedback",
    "caseId": "institutional-sacrificial-escalation",
    "title": "Psychological commitment escalation",
    "proposedAgentIds": [
      "actor-sacrificial-feedback"
    ],
    "agencyClaim": "A sunk-cost and grief-related pattern helps transform prior loss into pressure for continued commitment.",
    "agencyType": "systemic",
    "mechanismIds": [
      "mech-sunk-cost",
      "mech-rhetorical-reframing"
    ],
    "mediumIds": [
      "med-public-address",
      "med-commemoration"
    ],
    "manifestations": [
      "reversal risks being interpreted as invalidating prior deaths"
    ],
    "evidenceSupport": [
      "obs-rhetorical-obligation"
    ],
    "evidenceAgainst": [],
    "alternativeHypothesisIds": [
      "hyp-human-rhetorical-action",
      "hyp-institutional-agency",
      "hyp-symbolic-order"
    ],
    "assumptions": [
      "the pattern appears beyond this isolated phrase",
      "audiences experience the relevant commitment pressure"
    ],
    "falsifiers": [
      "comparative evidence that the rhetoric does not correlate with persistence or obligation"
    ],
    "lowerLevelExplanationsAssessed": [
      "hyp-human-rhetorical-action"
    ],
    "independentEvidence": [],
    "status": "proposed",
    "explanatoryNecessity": "contributory",
    "empiricalStatus": "underdetermined",
    "theologicalStatus": "not-applicable",
    "humanReviewRequired": false,
    "createdBy": "human",
    "reviewStatus": "draft",
    "notes": ""
  },
  {
    "hypothesisId": "hyp-institutional-agency",
    "caseId": "institutional-sacrificial-escalation",
    "title": "Institutional continuity and self-preservation",
    "proposedAgentIds": [
      "actor-union-state"
    ],
    "agencyClaim": "The institution's offices, commitments, and continuity pressures contribute causal direction beyond any single participant.",
    "agencyType": "institutional",
    "mechanismIds": [
      "mech-institutional-continuity",
      "mech-rhetorical-reframing"
    ],
    "mediumIds": [
      "med-state-offices",
      "med-public-address"
    ],
    "manifestations": [
      "continuation is represented as necessary to preserve purpose and prior sacrifice"
    ],
    "evidenceSupport": [
      "obs-rhetorical-obligation",
      "event-address-delivered"
    ],
    "evidenceAgainst": [],
    "alternativeHypothesisIds": [
      "hyp-human-rhetorical-action",
      "hyp-psychological-feedback",
      "hyp-symbolic-order",
      "hyp-layered-spiritual"
    ],
    "assumptions": [
      "institutional records will show persistence and continuity across actors"
    ],
    "falsifiers": [
      "evidence that the direction is fully explained by one actor without institutional persistence"
    ],
    "lowerLevelExplanationsAssessed": [
      "hyp-human-rhetorical-action",
      "hyp-psychological-feedback"
    ],
    "independentEvidence": [],
    "status": "proposed",
    "explanatoryNecessity": "unknown",
    "empiricalStatus": "underdetermined",
    "theologicalStatus": "not-applicable",
    "humanReviewRequired": false,
    "createdBy": "human",
    "reviewStatus": "draft",
    "notes": ""
  },
  {
    "hypothesisId": "hyp-symbolic-order",
    "caseId": "institutional-sacrificial-escalation",
    "title": "Sacralized symbolic-order mediation",
    "proposedAgentIds": [
      "actor-national-sacred-order"
    ],
    "agencyClaim": "A durable symbolic order organizes perception so national continuity and the meaning of the dead become mutually reinforcing.",
    "agencyType": "symbolic",
    "mechanismIds": [
      "mech-rhetorical-reframing",
      "mech-ritual-memory"
    ],
    "mediumIds": [
      "med-public-address",
      "med-commemoration"
    ],
    "manifestations": [
      "national purpose is treated as carrying sacred obligation"
    ],
    "evidenceSupport": [
      "obs-rhetorical-obligation",
      "event-address-delivered"
    ],
    "evidenceAgainst": [],
    "alternativeHypothesisIds": [
      "hyp-human-rhetorical-action",
      "hyp-psychological-feedback",
      "hyp-institutional-agency",
      "hyp-layered-spiritual"
    ],
    "assumptions": [
      "the language participates in a broader recurrent symbolic field"
    ],
    "falsifiers": [
      "evidence that the language is isolated and lacks broader ritual reproduction"
    ],
    "lowerLevelExplanationsAssessed": [
      "hyp-human-rhetorical-action",
      "hyp-psychological-feedback"
    ],
    "independentEvidence": [],
    "status": "proposed",
    "explanatoryNecessity": "unknown",
    "empiricalStatus": "underdetermined",
    "theologicalStatus": "tradition-contested",
    "humanReviewRequired": false,
    "createdBy": "human",
    "reviewStatus": "draft",
    "notes": ""
  },
  {
    "hypothesisId": "hyp-layered-spiritual",
    "caseId": "institutional-sacrificial-escalation",
    "title": "Layered hostile spiritual mediation",
    "proposedAgentIds": [
      "actor-hostile-spiritual-power",
      "actor-union-state",
      "actor-national-sacred-order"
    ],
    "agencyClaim": "A hostile spiritual intelligence may act through human, symbolic, psychological, and institutional media by amplifying false ultimacy and sacrificial domination.",
    "agencyType": "layered",
    "mechanismIds": [
      "mech-spiritual-deception-proposed",
      "mech-rhetorical-reframing",
      "mech-institutional-continuity"
    ],
    "mediumIds": [
      "med-public-address",
      "med-state-offices",
      "med-commemoration"
    ],
    "manifestations": [
      "the political order becomes resistant to correction and treats persons as material for preservation"
    ],
    "evidenceSupport": [
      "obs-rhetorical-obligation",
      "obs-pilot-no-presumption"
    ],
    "evidenceAgainst": [
      "obs-pilot-no-presumption"
    ],
    "alternativeHypothesisIds": [
      "hyp-human-rhetorical-action",
      "hyp-psychological-feedback",
      "hyp-institutional-agency",
      "hyp-symbolic-order"
    ],
    "assumptions": [
      "nonhuman spiritual agents exist",
      "spiritual agency can be mediated through ordinary mechanisms",
      "the case exhibits more than moral analogy"
    ],
    "falsifiers": [
      "failure to identify case-specific discriminating evidence beyond moral or canonical resemblance",
      "theological arguments that prohibit this attribution"
    ],
    "lowerLevelExplanationsAssessed": [
      "hyp-human-rhetorical-action",
      "hyp-psychological-feedback",
      "hyp-institutional-agency",
      "hyp-symbolic-order"
    ],
    "independentEvidence": [],
    "status": "underdetermined",
    "explanatoryNecessity": "compatible",
    "empiricalStatus": "not-empirically-testable",
    "theologicalStatus": "metaphysical-proposal",
    "humanReviewRequired": true,
    "createdBy": "human",
    "reviewStatus": "draft",
    "notes": "The pilot tests evidentiary and human-review constraints; it does not approve this attribution."
  }
]
